"id","name","description"
"1","Via Ferrata l'école du Nant de Rossane","Via ferrata école idéale pour l'apprentissage, située à environ 1000m d'altitude sur la rive droite du Col du Martinet. Ce parcours pédagogique se compose de trois secteurs distincts offrant une progression adaptée : un premier secteur assez difficile (100m) pour maîtriser les techniques de longes avec échelle de 5m et pont népalais de 8m, un deuxième secteur facile (80m) quasi horizontal sur vires avec passerelle de 5m, et un troisième secteur difficile (90m) incluant un pont de singe de 12m et une tyrolienne de 20m. Le parcours offre un magnifique panorama sur les paysages de la station des Aillons-Margériaz dans un environnement forestier. Difficulté croissante permettant une initiation en toute sécurité. Accès depuis le parking de la route de la Chapelle par sentier bien marqué en 10 minutes."
"2","Via Ferrata La Roche","Via ferrata située sur le site spectaculaire de La Roche, offrant un point de vue exceptionnel sur les gorges de la Vézère, le barrage du Saillant et le bassin de Brive. Ce parcours de 600 mètres permet de progresser sur une paroi rocheuse en milieu forestier avec un dénivelé de 167 mètres. Le parcours, rénové en 2022, propose des aménagements variés et ludiques : barreaux métalliques, ponts de singes, passerelle, filet métallique à grimper et une tyrolienne rapide (type speed). Accessible aux débutants comme aux pratiquants entraînés avec deux niveaux de difficulté (PD et AD), cette via offre une expérience complète dans un cadre naturel préservé. Gare SNCF à proximité à Allassac."
"3","Via Ferrata Le Roc de la Campana","Via ferrata récente construite dans le Grand Site classé du Massif du CanigÃ³. Le départ se situe à 50 mètres en dessous de la piscine naturelle du Mondony sur la rive droite. Ce parcours à progression verticale de difficulté moyenne (K2 - PD+) se compose de nombreux échelons métalliques et de 3 ponts de singe. Particulièrement adaptée aux débutants et aux enfants accompagnés d'adultes, elle évolue dans un environnement mixte de canyon et de forêt sur 200 mètres de dénivelé. L'itinéraire offre une belle découverte du massif avec une approche facile de 15 minutes et un retour en 45 minutes. Accessible toute l'année hors conditions météorologiques défavorables (pluie, vent fort, neige, orage) et arrêtés exceptionnels."
"4","Via Ferrata L'école Buissonnière","Petite via ferrata d'initiation située sur le site exceptionnel du Monolithe de Sardières, au cÅ“ur du Parc national de la Vanoise. Malgré sa cotation AD (assez difficile), ce parcours de 150 mètres est parfaitement adapté aux enfants et débutants entraînés. L'itinéraire ludique propose un enchaînement de passages dans les arbres et entre les deux impressionnants monolithes rocheux, offrant une expérience unique en milieu forestier. Le parcours se réalise en environ 1 heure avec une approche facile de 50 mètres à pied depuis le parking. Accessible depuis Aussois via la D83 direction Sardières, puis route du Monolithe (1 km jusqu'au Plan de la Croix). Site insolite à découvrir en famille."
"5","Via Ferrata du Diable - Les Angelots","Via ferrata spécialement conçue pour les enfants à partir de 5-6 ans, faisant partie du complexe exceptionnel des 7 Via Ferrata du Diable. Ce parcours ludique de 200 mètres évolue dans un environnement unique combinant cascade, forêt, gorges et site historique du Fort Victor-Emmanuel. Avec un départ insolite depuis le fort, cette via facile permet aux plus jeunes de découvrir l'activité en toute sécurité. Approche et retour très courts (5 minutes chacun) pour un accès facilité. Le site offre une expérience remarquable au cÅ“ur des gorges de l'Arc en Haute Maurienne Vanoise."
"6","Via Ferrata du Diable - Les Diablotins","Parcours du complexe des 7 Via Ferrata du Diable, spécialement adapté aux adultes débutants et enfants à partir de 9-10 ans (dès 6-8 ans pour la première partie). Ce tracé de 500 mètres propose une progression modulable avec un échappatoire permettant d'adapter la difficulté : niveau PD (peu difficile) avant l'échappatoire, AD (assez difficile) après. Avec une hauteur maximale de 50 mètres, cette via offre une belle initiation dans le cadre spectaculaire des gorges de l'Arc. Durée entre 45 minutes et 1h30 selon le rythme et le parcours choisi. Départ depuis le Fort Victor-Emmanuel, site historique remarquable."
"7","Via Ferrata du Diable - Le Chemin de la Vierge","Parcours du complexe des 7 Via Ferrata du Diable, itinéraire technique de 1100 mètres combinant descentes et montées. La descente de la Visitation est une traversée descendante avec 2 passerelles en bois alternant passages rocheux et sentiers, s'achevant par une échelle originale de 20 mètres face à la vue sur les gorges. Après 100 mètres de sentier menant au ressaut de l'Assomption, le dernier ressaut présente un passage athlétique et surtout une traversée finale splendide et impressionnante au-dessus de la cascade du Nant (hauteur 150m). Pour terminer, l'élégante passerelle de la Vierge franchit le ruisseau. Dénivelés positif et négatif de 100 mètres. Départ depuis la Redoute Marie-Thérèse (25 minutes d'approche)."
"8","Via Ferrata du Diable - La Traversée des Anges","Parcours du complexe des 7 Via Ferrata du Diable, itinéraire technique de 360 mètres de niveau difficile. La première partie descend dans une belle succession de vires et s'achève par la vertigineuse traversée des Séraphins. Cette traversée se poursuit de manière beaucoup plus physique dans la seconde partie, où une descente facile mène à un ressaut athlétique. Ce parcours exigeant offre des passages aériens remarquables dans le cadre spectaculaire des gorges de l'Arc. Durée approximative d'1h30. Approche rapide de 5 minutes et retour en 8 minutes depuis le Fort Victor-Emmanuel."
"9","Via Ferrata du Diable - La Montée au Ciel","Parcours du complexe des 7 Via Ferrata du Diable, section la plus haute avec plus de 200 mètres de hauteur. Après avoir passé le pont du Diable, ce parcours de 450 mètres propose des passages en dévers et une sortie spectaculaire directement dans le Fort Victor-Emmanuel. Avec 120 mètres de dénivelé positif, cette ascension difficile offre des sensations fortes et des vues imprenables sur les gorges de l'Arc. Durée entre 1 et 2 heures selon le rythme. Le départ s'effectue depuis le célèbre Pont du Diable, ajoutant au caractère unique de cette via ferrata historique."
"10","Via Ferrata du Diable - La Descente aux Enfers et Montée au Purgatoire","Parcours du complexe des 7 Via Ferrata du Diable, combinant descente et montée spectaculaires. Belle descente au fond des gorges de l'Arc, d'abord peu difficile puis s'accentuant pour devenir athlétique juste avant l'impressionnante passerelle des Enfers (hauteur 100m). La montée au Purgatoire s'élève ensuite dans une belle paroi et s'achève le long de la cascade du Nant. Itinéraire de 450 mètres de via ferrata plus 350 mètres de sentiers. Dénivelé négatif de 170 mètres puis positif de 120 mètres. Durée entre 1h30 et 3h. Départ depuis les batteries basses du Fort Victor-Emmanuel."
"11","Via Ferrata du Diable - Les Rois Mages","Parcours du complexe des 7 Via Ferrata du Diable, tronçon le plus récent et surtout le plus spectaculaire avec trois passerelles à couper le souffle : la passerelle Gaspard (pont népalais), la passerelle Balthazar (pont de singe) et la passerelle Melchior de 82 mètres, la plus longue au monde en via ferrata. Ce parcours de 300 mètres de niveau TD+ (très difficile) est réservé aux personnes initiées et expérimentées. Durée entre 1h et 1h30. Le départ s'effectue depuis les batteries basses du Fort Victor-Emmanuel, par la meurtrière de droite. Un itinéraire exceptionnel offrant des sensations extrêmes dans un cadre historique unique."
"12","Via Ferrata La Cascade des Nants","Via ferrata de niveau AD (assez difficile) faisant partie des 3 parcours de Bellevaux en accès libre. Ce parcours de 240 mètres évolue sur rocher calcaire en exposition ouest, offrant une belle progression le long d'une cascade dans un environnement forestier préservé. Avec 70 mètres de dénivelé entre 900m et 970m d'altitude, cette via courte mais technique est recommandée aux pratiquants entraînés. Le parcours se réalise en environ 1h15 avec une approche facile. Sans tyrolienne, elle offre une expérience authentique au cÅ“ur de la nature savoyarde. Accessible du 1er avril au 31 octobre, cette via ferrata permet de découvrir les cascades des Nants dans un cadre spectaculaire."
"13","Via Ferrata La Grotte de Cristal et la Tyrolienne","Via ferrata de niveau TD (très difficile) faisant partie des 3 parcours de Bellevaux en accès libre. Ce parcours exigeant de 360 mètres évolue sur rocher calcaire en exposition ouest, recommandé aux pratiquants confirmés. Avec 100 mètres de dénivelé entre 930m et 1030m d'altitude, cette via de longueur moyenne propose des passages techniques et se termine par une tyrolienne spectaculaire. Le parcours se réalise en environ 1h45 avec une marche d'approche nécessitant un petit effort depuis le parking de la place de la mairie. Dans un environnement forestier préservé, cette via ferrata offre une expérience intense et gratifiante pour les grimpeurs expérimentés. Accessible du 1er avril au 31 octobre."
"14","Via Ferrata Le Châtelard","Via ferrata de niveau D+ (difficile+) faisant partie des 3 parcours de Bellevaux en accès libre. Ce parcours technique de 360 mètres évolue sur rocher calcaire en exposition ouest, recommandé aux pratiquants confirmés. Avec 100 mètres de dénivelé entre 930m et 1030m d'altitude, cette via de longueur moyenne offre des passages exigeants dans un environnement forestier. Le parcours se réalise en environ 1h45 avec une marche d'approche nécessitant un petit effort depuis le parking de la place de la mairie. Sans tyrolienne, elle permet de se concentrer sur la technique d'escalade et offre une belle expérience aux grimpeurs expérimentés. Accessible du 1er avril au 31 octobre."
"15","Via Ferrata d'Andagne","Via ferrata en haute montagne se composant de trois parties distinctes offrant une progression adaptée du débutant au confirmé. Le parcours débute par Pierre Blanc dit ""le Pape"", section d'initiation accessible en 5 minutes idéale pour enfants et débutants (niveau F). La deuxième partie, la Vire du Greffier, sert à sécuriser l'accès à la troisième partie (niveau F). Le parcours Guy Favre, du nom d'un guide local disparu dans le massif du Mont Blanc, constitue la vraie via ferrata avec une partie terminale aérienne et exposée (niveau D). Une fois franchie, admirez le magnifique paysage alpin en compagnie des marmottes et chamois avant de rejoindre le parking par un sentier partiellement câblé. Parcours assez long de 3,6 km avec 430 mètres de dénivelé entre 1770m et 2200m d'altitude. IMPORTANT : Zone de Sensibilité Majeure du Gypaète Barbu - Ouverture uniquement du 1er septembre au 31 octobre, fermeture obligatoire du 1er novembre au 31 août pour protéger la nidification."
"16","Mini Via Ferrata de la Carrière de Boisseron","<p>Mini via ferrata ludique et familiale aménagée dans l'ancienne carrière de Boisseron sur les falaises créées par l'exploitation du calcaire coquillé. Ce parcours très court de<strong> 200 mètres</strong> avec une hauteur maximale de 8 mètres est parfaitement adapté aux débutants et aux enfants. Le site insolite propose un parcours varié et amusant : départ par un mur vertical de <strong>8m</strong>, un grand pont népalais de<strong> 25m</strong>, 3 petits ponts de singe et une <strong>tyrolienne de 50m </strong>avec poulie rapide. Approche et retour faciles en 5 minutes chacun. Le site dispose également d'un mur d'escalade avec 25 voies de 5 à 10m (niveau 4a à 6b). Attention : site naturel sans plateforme pour la tyrolienne, les précautions habituelles de sécurité s'imposent. Carrière gérée par l'association Accès Nature. Conception et réalisation par Antipodes en 2013.<strong> </strong></p>"
"17","Via Ferrata Le Roc du Gorb","Via ferrata ludique de niveau PD+ à AD située dans un cadre enchanteur au bord du Viaur, encaissée dans un écrin de verdure. Ce parcours de longueur moyenne offre des paysages variés remarquables : départ aérien avec vue sur le paysage vallonné et la rivière en contrebas, puis immersion en forêt avec la découverte spectaculaire de la petite cascade du ruisseau du Riou que vous pourrez approcher de très près grâce aux différents agrès (passerelle, ponts de singes et népalais, planche en bois). Le parcours se termine par une tyrolienne facultative de 100 mètres avec poulie rapide. Possibilité de faire un rappel de 25 mètres pour les pratiquants équipés. Site familial avec 50 mètres de dénivelé entre 200m et 250m d'altitude. Le site comprend également 135 voies d'escalade du niveau débutant à confirmé. Location de matériel disponible auprès de Mr Doucet Jacques au village de Bar."
"18","Via Ferrata Le Roc du Cornillon - Primevère à Oreille d'Ours","Via ferrata offrant une vue spectaculaire à 180Â° sur le Lac du Bourget depuis le belvédère. Le parcours ""Primevère à Oreille d'Ours"" tire son nom d'une plante rare présente sur le site. Ce parcours de 250 mètres de niveau AD+ évolue dans un environnement exceptionnel combinant lac, forêt et falaise avec des expositions variées (Nord, Est, Sud). Départ à 820m d'altitude avec 30 minutes d'approche depuis le parking du Col du Chat via l'itinéraire pédestre de la Dent du Chat. Retour en 35 minutes. Durée du parcours : 1 heure. Accessible depuis le Bourget-du-Lac (direction Abbaye d'Hautecombe) ou depuis Yenne (direction St Jean de Chevelu). Encadrement possible pour groupes et individuels. Gares SNCF à proximité : Chambéry et Aix-les-Bains."
"19","Via Ferrata Le Roc du Cornillon - Rocher du Cornillon","Via ferrata d'initiation offrant une superbe vue à 180Â° sur le Lac du Bourget depuis le belvédère. Le parcours ""Rocher du Cornillon"" est spécialement conçu pour l'initiation avec 120 mètres de niveau PD+. Ce parcours court évolue en exposition Sud dans un environnement exceptionnel combinant lac, forêt et falaise. Départ à 800m d'altitude avec 30 minutes d'approche depuis le parking du Col du Chat via l'itinéraire pédestre de la Dent du Chat. Retour en 35 minutes. Durée du parcours : 45 minutes. Idéal pour les débutants et entraînés souhaitant découvrir l'activité avec une vue panoramique remarquable. Accessible depuis le Bourget-du-Lac (direction Abbaye d'Hautecombe) ou depuis Yenne (direction St Jean de Chevelu). Encadrement possible pour groupes et individuels. Gares SNCF à proximité : Chambéry et Aix-les-Bains."
"20","Via Ferrata des Gorges d'Ambin","Nouvelle via ferrata inaugurée en juillet 2023, accessible dès 12 ans. Ce parcours de 300 mètres de niveau AD (assez difficile) évolue dans les spectaculaires gorges de l'Ambin à 1570m d'altitude avec environ 60 mètres de dénivelé. L'accès se fait par la nouvelle passerelle Himalayenne de 64 mètres, le départ se trouvant directement à droite après la traversée via un petit portillon. Le parcours propose des agrès variés : 1 pont de singe, 1 pont népalais et 2 tyroliennes en aller-retour. Attention : pas d'échappatoire sur ce parcours qui se pratique dans les gorges en rive droite côté amont de l'Ambin et ressort en rive gauche. Durée approximative : 1h30 avec approche et retour faciles de 5-10 minutes chacun. Environnement exceptionnel de cascade et canyon. Conception et réalisation : Géolithe et YDEMS. Gare SNCF TGV de Modane à 16 km, idéale pour découvrir aussi Valfréjus et Aussois."
"21","Via Ferrata La Croix de Toulouse","Via ferrata de haute montagne de niveau PD (peu difficile) offrant une belle ascension de 800 mètres sur rocher calcaire en orientation Sud. Ce parcours assez long évolue dans un environnement unique combinant haute montagne et proximité de la ville de Briançon. Avec un dénivelé total de 680 mètres (approche comprise) entre le parking du Champ de Mars à 1280m et le sommet de la Croix de Toulouse à 1967m d'altitude, cette via demande une bonne condition physique. La marche d'approche de 35 minutes est suivie d'une ascension de 2h à 3h sur la via. Idéale pour les débutants ayant une bonne endurance, elle offre des panoramas exceptionnels sur Briançon et les montagnes environnantes. Gare SNCF à Briançon. Pour informations sur les conditions et ouvertures, contacter le Bureau des Guides de Briançon."
"22","Via Ferrata Le Saint-Julien - La Grise","Nouveau parcours d'initiation 2023 du complexe du Saint-Julien, l'une des plus belles et plus longues via ferratas d'Europe (2000m au total). ""La Grise"" est une voie d'initiation adaptée aux adultes et enfants à partir de 1.35m de taille. Ce parcours de 300 mètres de niveau AD évolue sur crête avec un accès facile de 5 minutes. Durée approximative : 1 heure. Le site dispose de 3 parkings gratuits (Pin d'Aïs, Font de Ladon et Rieuchaud) avec 30 minutes de marche pour atteindre les départs de voies. Location et vente de matériel disponibles chez Baronnies Sport. Bureau des guides des Baronnies pour accompagnement. Construction YDEMS, maître d'Å“uvre Géolithe. Accessible toute l'année dans un environnement de crête spectaculaire."
"23","Via Ferrata Le Saint-Julien - La Pitchouno ""la petite""","Voie familiale d'initiation du complexe du Saint-Julien, l'une des plus belles et plus longues via ferratas d'Europe (2000m au total). ""La Pitchouno"" signifie ""la petite"" et est parfaitement adaptée aux familles avec une taille minimale requise de 1.25m. Ce parcours court de 170 mètres de niveau PD se réalise entre 30 minutes et 1 heure. Le site évolue sur crête offrant des vues spectaculaires. 3 parkings gratuits disponibles avec 30 minutes de marche d'approche. Location et vente de matériel chez Baronnies Sport. Bureau des guides des Baronnies pour accompagnement. Construction YDEMS, maître d'Å“uvre Géolithe. Accessible toute l'année."
"24","Via Ferrata Le Saint-Julien - La Testouriasso ""la têtue""","Parcours technique du complexe du Saint-Julien, l'une des plus belles et plus longues via ferratas d'Europe (2000m au total). ""La Testouriasso"" signifie ""la têtue"" et justifie son nom avec 440 mètres de niveau D (difficile). Taille minimale requise : 1.55-1.60m. Durée entre 1h45 et 2h15. Ce parcours exigeant évolue sur crête avec un gaz fort offrant des sensations aériennes remarquables. 3 parkings gratuits disponibles avec 30 minutes de marche d'approche. Location et vente de matériel chez Baronnies Sport. Bureau des guides des Baronnies pour accompagnement. Construction YDEMS, maître d'Å“uvre Géolithe. Accessible toute l'année."
"25","Via Ferrata Le Saint-Julien - La Tihousso ""la coriace""","Parcours technique du complexe du Saint-Julien, l'une des plus belles et plus longues via ferratas d'Europe (2000m au total). ""La Tihousso"" signifie ""la coriace"" et propose 460 mètres de niveau D (difficile) avec une tyrolienne facultative - la seule du site entier. Taille minimale requise : 1.50-1.60m. Durée entre 1h45 et 2h15. Ce parcours exigeant évolue sur crête avec un gaz fort offrant des passages aériens spectaculaires. 3 parkings gratuits disponibles avec 30 minutes de marche d'approche. Location et vente de matériel chez Baronnies Sport. Bureau des guides des Baronnies pour accompagnement. Construction YDEMS, maître d'Å“uvre Géolithe. Accessible toute l'année."
"26","Via Ferrata Le Saint-Julien - La Roumpo Quièu ""la casse-cul""","Parcours expert du complexe du Saint-Julien, l'une des plus belles et plus longues via ferratas d'Europe (2000m au total). ""La Roumpo Quièu"" signifie ""la casse-cul"" et constitue le parcours le plus long et difficile avec 640 mètres de niveau D+ incluant un passage facultatif en ED (extrêmement difficile). Taille minimale requise : 1.50-1.60m. Durée entre 2h et 2h30. Ce parcours réservé aux experts évolue sur crête avec un gaz fort offrant des passages très aériens et techniques. 3 parkings gratuits disponibles avec 30 minutes de marche d'approche. Location et vente de matériel chez Baronnies Sport. Bureau des guides des Baronnies pour accompagnement. Construction YDEMS, maître d'Å“uvre Géolithe. Accessible toute l'année."
"27","Rando-Ferrata de la Source de la Moselle - Petite Boucle","Rando-ferrata ludique évoluant sur terrain rocheux facile sans grandes parois verticales, avec plusieurs liaisons herbeuses. La petite boucle est une balade à flanc de colline surplombant la source de la Moselle, proposant une succession d'escalades rocheuses et de cheminements en forêt. Parcours de 560 mètres avec 200 mètres de dénivelé jusqu'à 860m d'altitude. Au programme : la poutre de la Brèche du téléphérique, la passerelle de 25m des Demoiselles et le cirque rocheux du Fer à cheval. Ce parcours de niveau PD offre plusieurs passerelles variées (pont népalais, pont de singe, poutres). Durée avec retour : 1h30 à 2h00. Approche facile dans un environnement forestier vosgien. Gare SNCF de Fellering à 13 minutes en voiture."
"28","Rando-Ferrata de la Source de la Moselle - Grande Boucle","Rando-ferrata évoluant sur terrain rocheux facile sans grandes parois verticales, avec plusieurs liaisons herbeuses. La grande boucle est une version rallongée et plus aventureuse que la première boucle, combinant les deux parties avec l'enchaînement des ponts et des poutres du haut du Charat. Parcours assez long de 850 mètres avec 300 mètres de dénivelé jusqu'à 960m d'altitude. Ce parcours de niveau AD inclut tous les éléments de la petite boucle (poutre de la Brèche du téléphérique, passerelle de 25m des Demoiselles, cirque rocheux du Fer à cheval) plus les passages techniques du haut du Charat. Plusieurs passerelles variées (pont népalais, pont de singe, poutres). Durée totale avec retour : 3h à 3h30. Environnement forestier vosgien dominant la source de la Moselle. Gare SNCF de Fellering à 13 minutes en voiture."
"29","Via Ferrata La Colline Saint-Jacques - Via Natura","Parcours familial innovant de la Colline Saint-Jacques permettant de découvrir la vie des falaises à partir de terrasses d'observation et d'interprétation. ""Via Natura"" propose une approche ludique et sportive de 250 mètres sur falaise calcaire de 50m de hauteur en exposition Sud-Est. Les plates-formes intégrées au cÅ“ur de jardins suspendus rythment et animent le parcours pour en faire un produit touristique et de découverte original. Niveau AD, réservé aux personnes mesurant plus de 1.30m. Agrès variés : pont népalais, échelons, poutres, ponts de grotte, passerelles et terrasses d'interprétation. Durée approximative : 2h. Circuit en boucle avec 1 échappatoire. Accès depuis l'office de tourisme (20 min à pied) ou parking Chemin de l'Ermitage. Gare SNCF de Cavaillon à 26 minutes à pied."
"30","Via Ferrata La Colline Saint-Jacques - Via Souterrata","Parcours sportif et spectaculaire de la Colline Saint-Jacques traversant les grottes du Colombier avant de franchir les Beaumes de Combarelles par des équipements remarquables. ""Via Souterrata"" propose un itinéraire original, ludique et pédagogique de 350 mètres offrant une approche novatrice du paysage et du relief des falaises pour mieux comprendre leur fonctionnement et évolution. Niveau TD (très difficile), réservé aux personnes mesurant plus de 1.50m. Falaise calcaire de 30m de hauteur en exposition Est. Agrès variés : ponts de grotte, échelle de grotte, ponts de singe, passages verticaux, boyaux souterrains et terrasses d'interprétation. Durée approximative : 2h. Circuit en boucle avec 1 échappatoire. Accès depuis l'office de tourisme (20 min à pied) ou parking Chemin de l'Ermitage. Gare SNCF de Cavaillon à 26 minutes à pied."
"31","Via Ferrata La Clapière (La Viste)","Via ferrata de haute montagne réservée aux pratiquants initiés et sportifs. Après une passerelle de 20 mètres, le parcours continue dans des murs beaucoup plus raides et aériens avec un gaz fort. Sur plus de 100 mètres de hauteur, une traversée ascendante vers la gauche franchit une succession de parois verticales avec des passages légèrement déversants. Une dernière dalle très compacte donne accès au sommet à 1980m d'altitude. Parcours de 500 mètres sur rocher calcaire en exposition Sud, combinant niveau AD et D (intermédiaire et difficile). Dénivelé de 260 mètres depuis le parking à 1720m. Ascension approximative de 2 heures avec une approche courte de 5 minutes et un retour en 30 minutes par sentier. Location de matériel disponible au magasin Le Névé Sports dans le village de Ceillac. Environnement exceptionnel du Queyras."
