"id","name","description"
"60","Via Ferrata Le Grand Bec - 1ère partie (Parcours d'arêtes)","Première partie du Grand Bec : parcours d'arêtes ludiques de 550 mètres dans une belle ambiance montagne. Très sportif pour personnes ayant déjà pratiqué la via ferrata. Succession de courtes escalades rocheuses et de cheminements sur sentier offrant de beaux points de vue sur la station et les massifs environnants. Véritable randonnée à ne pas sous-estimer avec 200 mètres de dénivelé jusqu'à 1950m d'altitude. Niveau AD+ dans environnement de haute montagne et forêt avec gaz fort. Durée 4 à 5 heures avec retour. Marche d'approche difficile. Peut être enchaîné avec la 2ème partie plus aérienne menant au sommet du Grand Bec à 2080m. Période favorable : mai à octobre selon enneigement. Contacter l'office de tourisme pour connaître l'accessibilité. Gare SNCF Jarrie-Vizille à 35 minutes."
"61","Via Ferrata Le Grand Bec - 2ème partie (Itinéraire aérien)","Deuxième partie du Grand Bec : itinéraire varié et très aérien de 200 mètres dans de grandes dalles ocre et noir. Très sportif réservé aux confirmés avec gaz omniprésent tout au long de l'itinéraire et sortie mémorable au milieu des surplombs. Niveau D+ avec gaz fort et 130 mètres de dénivelé jusqu'au sommet du Grand Bec à 2080m. Le passage par le sommet du Grand Bec et son belvédère est obligatoire avant de redescendre par le Lac Brouffier. Durée totale de l'itinéraire complet (1ère + 2ème partie) : 5h30 à 7h30. Environnement de haute montagne et forêt, marche d'approche difficile. Période favorable : mai à octobre selon enneigement. Contacter l'office de tourisme pour connaître l'accessibilité. Gare SNCF Jarrie-Vizille à 35 minutes."
"62","Via Ferrata de l'Adret","Via ferrata historique, première à avoir été équipée en Savoie. Parcours de 450 mètres de niveau D (difficile) avec enchaînement d'échelles suspendues puis une passerelle menant à une belle descente en rocher, le tout dans le cadre magnifique de la cascade de la Chal. Dénivelé de 150 mètres entre 550m et 700m d'altitude dans un environnement de cascade avec gaz moyen. Durée 1h30 avec approche facile de 15 minutes et retour en 10 minutes. Réservé aux pratiquants confirmés. IMPORTANT : Depuis 2018, par arrêté de sécurité, le deuxième segment dit ""du Bastion"" est fermé pour une durée indéterminée. Seule la première partie dite ""de la Passerelle"" reste accessible au public. Ouvert du 1er avril au 30 novembre en fonction des conditions climatiques."
"63","Via Ferrata Les Balcons de l'Orb - Inférieure","Via ferrata inférieure des Balcons de l'Orb offrant des vues magnifiques sur la vallée de l'Orb. Parcours court de niveau PD d'une durée de 30 minutes avec un pont de singe, dans un environnement forestier au départ de 340m d'altitude. Gaz faible, idéale pour les débutants. Accessible aux enfants de taille minimale de 1,40m (les enfants de moins de 40 kg doivent être encordés). Située à proximité du rocher d'escalade du Caussanel (32 voies de 4c à 6c+). Accès par le hameau du Bousquet de la Balme entre Bédarieux et La Tour sur Orb. Temps d'accès et retour : 20 minutes chacun. Accès gratuit toute l'année. Peut être combinée avec la via ferrata supérieure. Location matériel chez Arbre et Aventure (Bédarieux) ou gîte Lou Castelou (Dio). Gare SNCF Bédarieux à 10 min."
"64","Via Ferrata Les Balcons de l'Orb - Supérieure","Via ferrata supérieure des Balcons de l'Orb offrant des vues magnifiques sur la vallée de l'Orb. Parcours de niveau AD d'une durée de 1h30 avec pont de singe, pont tibétain, passerelle et tyrolienne (poulie rapide/speed), dans un environnement forestier au départ de 340m d'altitude. Gaz faible. Accessible aux enfants de taille minimale de 1,40m (les enfants de moins de 40 kg doivent être encordés). Située à proximité du rocher d'escalade du Caussanel (32 voies de 4c à 6c+). Accès par le hameau du Bousquet de la Balme entre Bédarieux et La Tour sur Orb. Temps d'accès et retour : 20 minutes chacun. Accès gratuit toute l'année. Peut être combinée avec la via ferrata inférieure. Location matériel chez Arbre et Aventure (Bédarieux) ou gîte Lou Castelou (Dio). Gare SNCF Bédarieux à 10 min."
"65","Via Ferrata Le Col de la Madeleine","Ancienne via cordata transformée en via ferrata ludique et accessible par l'ajout d'une ligne de vie continue. Parcours de 400 mètres de niveau AD avec 100 mètres de dénivelé entre 1720m et 1820m d'altitude, situé sur l'ancienne route qui mène au col de la Madeleine en direction de Bessans. Le parcours offre des passages latéraux généralement simples avec quelques passages raides, en exposition Sud. Durée inférieure à 1h30 avec marche d'approche facile et retour en moins de 20 minutes. Via ferrata ludique adaptée aux pratiquants entraînés dans un environnement de falaise et forêt avec gaz faible. Accessible du 15 mai au 31 octobre sous réserve de conditions météo favorables. Bureau de Lanslevillard disponible pour informations complémentaires."
"66","Via Ferrata Le Pichet","Via ferrata courte de 350 mètres de niveau AD à 1600m d'altitude maximum, située sous la falaise du Pichet. Le parcours débute par un sentier puis une échelle de 9 mètres (peut être évitée par un chemin balisé), suivi d'une traversée jusqu'au pied d'une dalle, ascension de la dalle, seconde traversée jusqu'à une passerelle puis retour. Exposition Sud/Sud-Est avec gaz faible. Durée approximative 1h30 avec temps d'accès de 15 minutes et retour en 15 minutes. Marche d'approche nécessitant un petit effort. Située en environnement de falaise, accessible depuis Val Cenis le Haut par chemin de terre. Accès libre toute l'année selon conditions météo. Bureau de Lanslevillard disponible pour informations complémentaires."
"67","Via Ferrata La Tour du Jallouvre - 1ère partie (jusqu'à Sortie à Fred)","Première partie de la Tour du Jallouvre : parcours long et exigeant avec variante Eterlou de 500m plus accessible. Après 20-30 minutes de marche, cheminement en traversée ascendante à gauche avec succession de terrasses en bon rocher menant à l'Arche du Bouquetin. Le passage clé est le dévers du ""Cul Tourné"" : léger dévers franchi par petits échelons avec gestes d'escalade. Deux variantes : passage à Coco (AD) ou dévers du Cul Tourné (D+). Après montée rocheuse et cheminement facile, traversée vers la Tour. Possibilité d'interruption par ""Sortie à Fred"" : vire commode puis courte descente sur échelons (garder équipement pour main courante au retour). Ambiance aérienne et minérale en haute montagne. Durée 2h-3h, dénivelé 450m. Gaz fort. Difficulté liée à longueur et retour délicat en début saison."
"68","Via Ferrata La Tour du Jallouvre - 2ème partie (accès à la Tour)","Deuxième partie de la Tour du Jallouvre de niveau D+ : 1100 mètres au total avec ambiance très aérienne et minérale. L'accès à la Tour s'effectue par la passerelle du Gypaète de 16 mètres très aérienne, dominée par le beau pilier raide ""le Pilier des Courants d'Air"" procurant de très fortes sensations. Grande traversée rocheuse bordant la face ponctuée par une passerelle sur demi-tronc de mélèze pouvant créer quelques émotions. Une grande arête facile et esthétique donne accès au sommet de la Tour à 2000m. Durée totale parcours complet : 5-6h (montée + descente). DIFFICULTÃ‰ liée à longueur importante de l'itinéraire, engagement après franchissement passerelle et retour délicat en début saison. Dénivelé total 590m en haute montagne, exposition Sud-Ouest, gaz fort."
"69","Via Ferrata Le Rocher de Moïse","Via ferrata située sur versant Ouest du causse de Mende, orientée face Ouest au regard du Lot puis face Sud. Le parcours se développe horizontalement pour atteindre une cavité rocheuse où 2 parcours se présentent : un facile (PD) et un difficile (D). Le parcours difficile emprunte une lucarne puis un tracé vertical de 6m sollicitant fortement les bras avant de rejoindre le parcours facile. L'itinéraire devient commun jusqu'à la base d'un pilier de 30 mètres. Le parcours difficile dessine un tracé vertical pour sortir à son sommet, tandis que le parcours facile reste horizontal pour atteindre la tyrolienne de 35m. Le parcours comprend un pont népalais, un pont de singe et 2 tyroliennes (aller/retour sur même secteur, poulies speed). Durée 2h-3h, dénivelé 50m (890m-940m), gaz moyen. Accès pédestre 25 min. Sentier balisé permet retour au parking. Location : Loc Via 48 (15â‚¬/demi-journée). Gare SNCF Mende à 10 min."
"70","Via Ferrata Le Boffi","Via ferrata sur les falaises du Causse Noir au-dessus des Gorges de la Dourbie offrant une vue spectaculaire sur le viaduc de Millau et le plateau du Larzac. Parcours assez long de 800 mètres avec 80 mètres de dénivelé entre 365m et 445m, proposant deux niveaux PD et TD. Très aérienne mais ludique selon parcours choisi. Parcours récemment rénovés avec filet de 20m de haut procurant la sensation d'être suspendu dans le vide. Comprend 2 tyroliennes : une de 75m (évitable par passerelle ou sentier) et une de 90m (évitable par sentier), poulies rapides. Gaz fort, expositions variées Nord-Ouest à Sud-Est. En été, privilégier le matin car falaise plein sud. Magnifiques oiseaux présents. Conception Antipodes 2001, modernisée 2015-2016. CRITIQUE : Interdite du 15 mars au 15 juin (nidification espèces protégées). Location Antipodes 20â‚¬. Gare SNCF Millau 25 min."
"71","Via Ferrata La Tour du Jallouvre - Parcours complet (jusqu'à la Tour)","Parcours complet de la Tour du Jallouvre de 1100 mètres (variante Eterlou 500m plus accessible) avec ambiance très aérienne et minérale de niveau AD à D+. L'accès à la Tour s'effectue par la passerelle du Gypaète de 16 mètres très aérienne, dominée par le beau pilier raide ""le Pilier des Courants d'Air"" procurant de très fortes sensations. Grande traversée rocheuse bordant la face ponctuée par passerelle sur demi-tronc de mélèze pouvant créer quelques émotions. Grande arête facile et esthétique donne accès au sommet de la Tour à 2000m. RETOUR : Grande traversée dans face du Jallouvre puis couloir raide équipé d'un câble pour arriver à Combe du Rasoir où l'on rejoint bon sentier. ATTENTION neige en début de saison. Durée totale 5-6h (montée+descente). DIFFICULTÃ‰ liée à longueur importante, engagement après passerelle et retour délicat en début saison. Dénivelé total 590m, exposition Sud-Ouest, gaz fort."
"72","Via Ferrata des Juscles - Parcours Découverte","Parcours découverte de la via ferrata des Juscles offrant une magnifique balade perchée sur un plateau rocheux avec vue magnifique et agrès très variés pour le bonheur des via-ferratistes. Parcours de 300 mètres de niveau PD (peu difficile) avec 80 mètres de dénivelé dans un environnement de forêt et grotte. Gaz faible, approche facile, tyrolienne présente. Durée de 1h00 à 1h30. Idéal pour débutants et familles. Taille minimum : 1m40. Enfants de moins de 16 ans doivent être accompagnés. Ã‰quipement obligatoire disponible en location chez Alternatif Shop Le Pertuis (06.50.51.76.38) ou bar du Col du Pertuis (04.71.57.60.79). Possibilité d'encadrement par accompagnateur diplômé pour les groupes. Accessible toute l'année selon météo. Interdite la nuit."
"73","Via Ferrata des Juscles - Parcours Sportif","Parcours sportif de la via ferrata des Juscles offrant une magnifique balade perchée sur un plateau rocheux avec vue magnifique et agrès très variés. Parcours de 550 mètres de niveau AD (assez difficile) avec 150 mètres de dénivelé dans un environnement de forêt et grotte. Gaz faible, approche facile, tyrolienne présente. Durée de 1h30 à 2h00. Réservé aux pratiquants entraînés. Taille minimum : 1m40. Enfants de moins de 16 ans doivent être accompagnés. Ã‰quipement obligatoire disponible en location chez Alternatif Shop Le Pertuis (06.50.51.76.38) ou bar du Col du Pertuis (04.71.57.60.79). Possibilité d'encadrement par accompagnateur diplômé pour les groupes. Accessible toute l'année selon météo. Interdite la nuit."
"74","Via Ferrata de Fort l'Ã‰cluse","Via ferrata de 400 mètres de niveau AD (parfois D) offrant une sortie sans trop de difficultés avec vue splendide sur le Rhône et le défilé de l'Ã‰cluse. L'itinéraire se déroule dans la raide paroi calcaire qui sépare le fort inférieur du fort supérieur, ajoutant un intérêt historique au parcours. Après courte marche d'approche, progression successive sur ressauts plus ou moins raides entrecoupés de vires et terrasses confortables pour parvenir au pied de la muraille du fort supérieur parcourue sur bonne vire jusqu'au fossé sous le pont levis. Le franchissement du fossé s'effectue par un pont de singe de 15 mètres. On parvient à la route d'accès au fort (interdite à la circulation) par très courte remontée. Dénivelé 150m entre 430m et 580m, gaz moyen. Durée 1h30, accès 5 min, retour 20 min par sentier. IMPORTANT : Interdite par temps orageux, enneigement ou de nuit. Gares SNCF Bellegarde et Valleiry."
"75","Via Ferrata La Cascade","Via ferrata sportive de 400 mètres de niveau D+ voire TD avec 150 mètres de dénivelé entre 1700m et 1850m d'altitude sur rocher calcaire en exposition Est. Itinéraire sportif dans un environnement de falaise et forêt avec gaz fort. Le parcours comprend une passerelle et propose deux échappatoires permettant de réduire l'engagement selon les capacités. Durée d'ascension environ 2 heures avec marche d'approche de 30 minutes depuis le parking à 1640m et retour en 30 minutes. Réservé aux pratiquants confirmés. Encadrement possible avec le Bureau des guides d'Embrun. Location d'équipement disponible aux Orres 1650 (Intersport, Sport 2000, Le Zappeur) et aux Orres 1800 (Intersport, Skimium, Ski Set). Accessible du 1er mai au 31 octobre."
"76","Via Ferrata La Marcellinas","Via ferrata petite sÅ“ur de La Cascade avec un parcours moins sportif et plus découverte. Parcours court de 300 mètres de niveau PD à AD (initiation/intermédiaire) avec 80 mètres de dénivelé entre 1840m et 1920m d'altitude sur rocher calcaire en exposition Est. Idéale pour l'initiation et la découverte dans un environnement de falaise et forêt avec gaz moyen. Le parcours comprend 2 câbles de pieds et 1 passerelle. Durée d'ascension environ 2 heures (en général moins) avec marche d'approche de 30 minutes depuis le parking à 1640m. Adaptée aux débutants et pratiquants entraînés. Encadrement possible avec le Bureau des guides d'Embrun. Location d'équipement disponible aux Orres 1650 (Intersport, Sport 2000, Le Zappeur) et aux Orres 1800 (Intersport, Skimium, Ski Set). Accessible du 1er mai au 31 octobre."
"77","Via Ferrata Les Vigneaux - Le Colombier","Via ferrata historique et très aérienne au Pays des Ã‰crins. Parcours Le Colombier de niveau AD, plus accessible. Première partie commune avec La Balme : progression ascendante vers la gauche amenant à un mur raide assez athlétique, débouchant sur une vire où se divisent les 2 itinéraires. Le Colombier traverse à gauche pour rejoindre une échelle métallique. Un dernier passage aérien sur le fil du pilier donne accès au dièdre terminal. Continuer le chemin jusqu'à la piste forestière. Dénivelé 200m entre 1300m et 1500m, parking à 1100m. Rocher calcaire, exposition Sud, gaz fort. Durée 2h avec approche difficile et raide de 25 minutes, retour 40 min. Haute montagne réservée aux pratiquants entraînés. Encadrement : Bureaux des guides des Ã‰crins ou Vallouise. Gare SNCF L'Argentière-les-Ã‰crins."
"78","Via Ferrata Les Vigneaux - La Balme","Via ferrata historique et très aérienne au Pays des Ã‰crins. Parcours La Balme de niveau D+, plus sportif. Première partie commune avec Le Colombier : progression ascendante vers la gauche amenant à un mur raide assez athlétique, débouchant sur une vire où se divisent les 2 itinéraires. La Balme continue droit au-dessus jusqu'à déboucher sur une bonne vire amenant au pied d'une cheminée surplombante. Passage très athlétique sur 15 mètres en exploitant bien les marches en place. Vire descendante conduisant au dernier mur raide. Chemin câblé mène directement au sommet de la falaise. Dénivelé 200m entre 1300m et 1500m, parking à 1100m. Rocher calcaire, exposition Sud, gaz fort. Durée 2h avec approche difficile et raide de 25 minutes, retour 40 min. Haute montagne réservée aux confirmés. Encadrement : Bureaux des guides des Ã‰crins ou Vallouise. Gare SNCF L'Argentière-les-Ã‰crins."
"79","Via Ferrata Le Haut des Gorges du Cher","Via ferrata courte de niveau PD permettant de prendre de la hauteur pour profiter au mieux des paysages des Gorges du Cher. Parcours d'environ 1 heure dans un environnement de forêt et rivière avec gaz faible, idéal pour les débutants. Approche facile de 10 minutes. Cette activité est accessible en totale autonomie avec votre propre matériel. Ã€ proximité immédiate, les passerelles des Gorges du Cher permettent de passer d'une rive à l'autre ou de longer la paroi rocheuse au fil de l'eau. IMPORTANT : Réouverte depuis le 22 mars 2025. ATTENTION : Fermetures temporaires possibles en fonction des périodes de nidification d'une espèce de rapace protégée présente sur place. Ouverture prévue du 22 mars au 31 décembre 2025. Vérifier auprès de l'office de tourisme avant de se déplacer."
"80","Via Ferrata Le Claps","Via ferrata sur un site géologique et historique exceptionnel. En 1442, une assise se détacha du flanc sud du Pic de Luc et vint heurter un éperon calcaire. Elle se divisa en blocs énormes et barra la Drôme en deux points, formant deux lacs. En 1804 fut percé un énorme bloc pour laisser s'écouler les eaux à l'endroit de l'actuel Saut de la Drôme. Aujourd'hui, ce site classé est un lieu d'escalade réputé où les familles pique-niquent l'été les pieds dans l'eau. Parcours assez long de 650 mètres de niveau AD+ avec 200 mètres de dénivelé entre 600m et 800m d'altitude, en exposition Nord. Durée 1h30 à 2h avec approche facile et retour en 20-30 minutes. Gaz faible dans environnement exceptionnel de falaise, forêt et rivière. Une des 4 via ferratas du Pays Diois. Gare SNCF Luc-en-Diois à 4 min en voiture, 9 min à vélo, 25 min à pied. NOTE : Parking du snack réservé à la clientèle."
"81","Via Ferrata La Berche","Via ferrata caractérisée par 3 sections très distinctes de 650 mètres de niveau AD à D avec 300 mètres de dénivelé entre 1140m et 1440m, en exposition Sud-Ouest. Section 1 : débute par un pilier à l'extrême droite de l'école d'escalade de la Berche avec niveau progressif suivant la crête et passages athlétiques pouvant être évités par des variantes. Section 2 : se rejoint par court sentier et évolue sur éperons et dalles raides. Section 3 : chemin menant à route forestière (à suivre à gauche sur 500 mètres), puis sentier à gauche pour accéder à la passerelle de la tour débouchant au sommet. Courte descente raide permet de rejoindre sentier de retour. Durée 3h, retour 20 min. IMPORTANT : Garder équipements car parcours en 3 parties. Gaz faible, approche facile. Une des 4 via du Pays Diois. Parking recommandé à La Jarjatte (400m). Gare SNCF Lus la Croix Haute 8 min."
"82","Via Ferrata Le Pont Napoléon","Via ferrata insolite située sous le Pont Napoléon à 750m d'altitude. Accès depuis rive gauche du pont (versant Saint-Sauveur) en descendant par petit chemin rejoignant la rivière. Parcours court de 150 mètres câblés avec 70 mètres de dénivelé, relativement aérien avec passage légèrement surplombant de niveau D+. Le parcours débute par un mur raide suivi d'une vire et passage transversal légèrement déversant. Nouvelle traversée et remontée d'un passage vertical déposent au pied de la pile du pont. Nouvelle traversée dans beau mur suivie d'un passage assez aérien rejoint une vire puis le sentier. Durée 1 heure, approche facile 10 minutes. Gaz moyen. IMPORTANT : Depuis le sentier, possibilité de traverser le ravin par tyrolienne de 110m puis rejoindre l'autre versant par pont népalais, MAIS ces 2 agrès sont PAYANTS et accessibles uniquement avec encadrement professionnel obligatoire."
"83","Via Ferrata Le Malzieu","Via ferrata permettant de découvrir les gorges de la Truyère sous de spectaculaires points de vue. Ascension vertigineuse mais sécurisée procurant de belles sensations avec 60 mètres de dénivelé entre 860m et 920m d'altitude. Deux niveaux de difficultés physiques s'adaptant aussi bien aux débutants qu'aux pratiquants confirmés : un parcours facile (PD) et un parcours difficile (AD voire D). Environnement de gorges avec gaz faible, approche facile. Comprend 1 tyrolienne avec poulie rapide (speed). Site en accès libre toute l'année. Conception et réalisation : Antipodes en 2012. Accompagnement possible avec Lozère Escalade - Nicolas Talon. Location équipement : Loc Via 48 (15â‚¬/demi-journée, 28â‚¬/journée, 50â‚¬/week-end, réservation obligatoire)."
"84","Via Ferrata de Mazamet - Parcours complet avec tyroliennes","Via ferrata complète sur le site de la fameuse passerelle d'Hautpoul permettant d'arpenter les chemins rocheux et jouer les aventuriers équilibristes en toute sécurité. Parcours complet de 880 mètres avec 90 mètres de dénivelé de niveau AD à D+. En contrebas du village d'Hautpoul, plus de 880 mètres de via ferrata. Durée environ 2h30 pour l'ensemble du superbe parcours. Chemins aériens le long de la roche avec 4 tyroliennes dont 1 de 210 mètres ! Possibilité de faire uniquement la grande tyrolienne sans parcours complet. Une première partie ""débutant"" accessible permet de tester sa capacité à faire ou non l'ensemble. Gaz moyen, approche 20 min, retour 20 min. Poulies speed. Circuits en accès libre non accompagnés pour public averti. Néophytes : contacter accompagnateur diplômé. Conception Antipodes 2022, maître d'Å“uvre Alpes Ingé. Gare SNCF Mazamet."
"85","Via Ferrata de Mazamet - Sans tyroliennes","Via ferrata sur le site de la passerelle d'Hautpoul, parcours sans tyroliennes de 370 mètres avec 110 mètres de dénivelé de niveau AD à D+. En contrebas du village d'Hautpoul, ce parcours permet d'arpenter les chemins rocheux aériens le long de la roche en toute sécurité sans emprunter les tyroliennes. Durée environ 1h30. Une première partie ""débutant"" accessible permet de tester sa capacité. Gaz moyen, approche 30 min, retour 20 min. Circuits en accès libre non accompagnés pour public averti. Néophytes : contacter accompagnateur diplômé pour première initiation. Conception Antipodes 2022, maître d'Å“uvre Alpes Ingé. Gare SNCF Mazamet."
"86","Via Ferrata de Mazamet - Via Ferrata supérieure d'Hautpoul","Via ferrata supérieure d'Hautpoul sur le site de la fameuse passerelle, parcours court de 130 mètres avec 60 mètres de dénivelé de niveau PD. Parcours accessible aux débutants permettant de découvrir l'activité en contrebas du village d'Hautpoul. Durée environ 45 minutes. Chemins aériens le long de la roche en toute sécurité avec gaz moyen. Approche 20 min, retour 25 min. Circuits en accès libre non accompagnés pour public averti. Néophytes : contacter accompagnateur diplômé pour première initiation. Fait partie du système de via ferratas du site d'Hautpoul. Conception Antipodes 2022, maître d'Å“uvre Alpes Ingé. Gare SNCF Mazamet."
"87","Mini via ferrata de Céüze (Céüse)","Mini via ferrata servant de voie d'accès au plateau de Céüze permettant d'admirer un panorama à 360Â° dans un environnement mondialement connu pour la grimpe. C'est plus une randonnée avec la via ferrata en cerise sur le gâteau. Parcours très court de seulement 40 mètres pour 35 mètres de hauteur, niveau PD sur rocher calcaire en exposition Sud-Est. Ascension inférieure à 30 minutes mais approche longue d'environ 1h30 depuis le parking à 1150m. Le sentier assez raide rejoint le pied de la falaise. La via est située à droite de la cascade. Une fois sur le plateau à 2016m, possibilité de continuer vers le Pic de Céüze (40 min supplémentaires). Retour par le plateau et Col en passant le Torrent de Lumineuse (environ 2h). Gaz moyen. IMPORTANT : Voie interdite à la descente. NOTE : Une nouvelle mini via ferrata pour enfants est disponible à proximité de la Maison de Céüze."
"88","Via Ferrata Le Voile de la Mariée (Cascade de la Pisse)","Via ferrata athlétique, longue et aérienne servant d'introduction à l'alpinisme avec sensations et paysage 100% Oisans. Parcours assez long très vertical de 250 mètres de grimpe sur câble avec 210 mètres de dénivelé entre 1240m et 1450m, niveau D+. L'itinéraire suit la cascade sans discontinuer avec gaz fort en exposition Sud. Aucune échappatoire possible sauf belle vire rocheuse à mi-hauteur permettant un repos. Préparez vos bras pour ce parcours très vertical ! Une fois au sommet, on rejoint le refuge des Clots en 5 minutes. Retour possible par la via qui redescend de l'autre côté du refuge (1h) - RARE : possibilité de faire une via en boucle ! Ou retour par chemin des Aymes jusqu'à la route (1h30). Durée totale 3h30. Plateau d'Emparis classé et protégé depuis 1991, balcon face à La Meije - zone à préserver. Guide via ferrata Oisans page 9."
