"id","name","description"
"32","Via Ferrata Le Pas de l'Echelle","Via ferrata historique empruntant un ancien passage utilisé autrefois pour joindre la vallée de l'Oule et la vallée de la Roanne avant la création de la route. Le nom ""Pas de l'Echelle"" vient probablement d'une échelle posée dans le ruisseau de l'Aiguebelle qui permettait au facteur de raccourcir ses tournées. Parcours de 650 mètres avec 198 mètres de dénivelé entre 782m et 980m d'altitude. Deux accès possibles : 1) en bordure de la départementale au niveau du pont par succession d'échelles et poutres en encorbellement, 2) par tyrolienne de 40m avec poulie Petzl speed + longe courte. L'itinéraire se déroule par succession de vires étroites et murs raides en exposition Sud, assez aérien mais rarement athlétique. Une échappatoire avant descente verticale donne accès au sentier de retour. Niveau AD+, durée 1h15 à 1h45, retour 20-30 minutes. Approche facile, gaz moyen."
"33","Via Ferrata Le Rocher de l'Olme","Via ferrata familiale idéale pour la découverte et les premières sensations de grimpe. Ce parcours très court de 120 mètres de niveau F (facile) est parfaitement adapté aux familles et débutants, accessible aux enfants à partir de 1m30 (les enfants de moins de 40kg doivent être encordés). Ã‰quipée de câbles métalliques et échelons, elle évolue en environnement forestier avec un gaz faible. Le parcours permet d'accéder à des panoramas spectaculaires sur les monts du Forez ainsi qu'à un abri en bois situé sur l'esplanade avec table de pique-nique, parfait pour une sortie familiale. Approche facile, pas de tyrolienne. Matériel obligatoire : casque, baudrier, longe avec absorbeur de choc. Gants conseillés. Location de matériel disponible au RDV des Sportifs à la station."
"34","Via Ferrata de Chironne","Via ferrata technique et aérienne dans un environnement exceptionnel surplombant le Diois, invitant à la découverte du milieu vertical. Parcours de 500 mètres avec 160 mètres de dénivelé entre 1215m et 1375m, composé de 4 sections très distinctes de niveau D à TD : 1) La Chandelle débute à droite de l'école d'escalade avec ascension d'une grande dalle et dièdre menant à la brèche (variante plus facile possible), 2) La Traversée des Toits, section la plus impressionnante avec nombreux surplombs athlétiques et vertigineux débouchant sur la grande vire, 3) La Grande Vire, chemin câblé offrant un magnifique belvédère sur le pays du Diois, passage étroit et aérien, 4) La Sortie des Dalles pour atteindre l'ultime bastion. Exposition Est, gaz fort. Retour en 20 minutes par chemin balisé. IMPORTANT : Zone de protection du Vautour Fauve - Période sensible de Décembre à Août, éviter d'y aller durant cette période. Gare SNCF de Die à 25 minutes."
"35","Via Ferrata Les Grosses Pierres","Via ferrata extrêmement difficile et très athlétique réservée exclusivement aux grimpeurs expérimentés. Ce parcours vertical court de 200 mètres avec 80 mètres de dénivelé entre 1290m et 1370m d'altitude offre un défi technique intense dans un environnement de falaise et forêt au-dessus de Champagny le Bas. Niveau ED (extrêmement difficile), exposition Sud avec un gaz fort. Le parcours comprend une poutre et un pont de singe. Durée : 1h à 1h30 pour l'aller, 30 minutes pour le retour. Approche facile depuis le quartier du Planay à Champagny le Bas : prendre le chemin de terre au bout du quartier, puis le sentier qui monte à gauche direction Plan des Mains. Ouvert du 15 juin au 31 octobre sous réserve de conditions météo favorables. Bureau des guides de Champagny disponible en juillet-août pour accompagnement."
"36","Via Ferrata Plan du Bouc","Magnifique randonnée verticale au cÅ“ur de la Vanoise, au-dessus des hameaux de caractère de Champagny le Haut. Via ferrata assez longue de 900 mètres avec 450 mètres de dénivelé entre 1500m et 1950m d'altitude, composée de 2 parcours avec départs différents mais arrivées communes : partie 1 de niveau PD (peu difficile) et partie 2 de niveau AD (assez difficile). Ce parcours en environnement de falaise avec gaz moyen offre une belle progression adaptée du débutant à l'entraîné. Temps d'approche : 15 minutes, retour : 50 minutes. Zone d'escalade à proximité, attention à vos objets. IMPORTANT : Interdite durant le reste de l'année car zone d'hivernage des grands ongulés sauvages. Accessible uniquement du 15 juin au 31 octobre sous réserve de conditions météo favorables. Bureau des guides de Champagny disponible pour accompagnement."
"37","Via Ferrata Les Echelles de la Mort","Via ferrata impressionnante et technique, considérée comme la plus belle du secteur. Parcours assez long de 500 mètres avec 100 mètres de dénivelé à 600m d'altitude, de niveau AD (AD+ selon certains pratiquants) sur rocher calcaire en exposition Sud. Le parcours propose de nombreux ponts de singe dont un remarquable à 3 câbles qui semblera interminable et mouvant, ainsi que des dévers, échelles et une tyrolienne facultative. Durée entre 2 et 3 heures avec échappatoires en cours de route. Vue magnifique sur les gorges du Doubs, appelées Vallée de la Mort en référence au passé de contrebande de la région. Immersion nature garantie dans un environnement de gorges et forêt. Le site comprend également des escaliers (distincts de la via) permettant l'accès au belvédère. Taille minimum : 1m50. Accès par parking de l'usine hydroélectrique du Refrain (route étroite déconseillée aux camping-cars). Bivouac possible sur place avec abris disponibles."
"38","Via Ferrata Le Fort Château-Queyras","Via ferrata familiale au pied du château médiéval de Château-Queyras, le long des spectaculaires gorges du Guil. Parcours de 500 mètres avec seulement 53 mètres de dénivelé entre 1347m et 1400m d'altitude, sur rocher calcaire en exposition Est-Ouest. Le cheminement aérien et ludique avec passerelle et pont népalais convient particulièrement aux enfants et adultes pour une première expérience, niveau PD (peu difficile). Gaz faible, idéal pour les débutants. Points de vue insolites sur la rivière et le château médiéval durant tout le parcours. Durée approximative : 2 heures avec une approche très courte de 2 minutes seulement. NOUVEAUTÃ‰ 2025 : Réouverture de l'autre rive le 15 juillet 2025 après plus de 10 ans de fermeture, travaux effectués par Roc Aventure. Site très fréquenté en période estivale. Environnement exceptionnel de canyon dans le Queyras."
"39","Via Ferrata Les Gorges du Gardon","Via ferrata ludique pour découvrir les gorges du Gardon autrement et prendre de la hauteur. Parcours de 550 mètres de niveau AD+ sur rocher calcaire avec falaises atteignant 50 mètres de hauteur, en exposition Sud/Sud-Est. Le parcours propose des échelons, de belles prises naturelles, un pont de singe et 2 petites tyroliennes avec poulies speed (rapides). Vous serez plongé au cÅ“ur du cadre rafraîchissant des gorges du Gardon dans un environnement de gorges et forêt. Durée approximative : 1 heure avec 15 minutes d'approche. 3 échappatoires disponibles. ATTENTION : les tyroliennes ne disposent pas de plateforme au départ ni de tapis de réception ou corde à l'arrivée - freinez-vous avec les gants et évitez de mettre les mains devant par réflexe. Le parcours n'est pas très bien balisé. Parking Place du Marché (sauf mercredis matin) ou nouveau parking gratuit Chemin de Vignette. Conception et réalisation : Techni Grimp. Gare SNCF de Remoulins."
"40","Via Ferrata Le Rocher de Neuf heures (Rocher de 9H)","Via ferrata au départ du centre-ville offrant plusieurs itinéraires et une vue imprenable sur Digne les Bains. Parcours assez long de 750 mètres de niveau AD+ à D (assez difficile à difficile) avec un gaz fort, en exposition Sud-Est garantissant un ensoleillement toute l'année. En été, il est recommandé de s'y rendre le matin pour profiter de la fraîcheur de l'ombre. Durée très variable selon itinéraire choisi : de 45 minutes à 3h30/4h. Départ à 600m d'altitude. Avant de redescendre, ne manquez pas le magnifique point de vue depuis le Rocher de 9H. Marche d'approche de 45 min à 1h, retour en 30 minutes. Accessible aux enfants à partir d'1m40 et 40 kg. Location d'équipement complet disponible (adulte 17â‚¬, enfant/étudiant 15â‚¬). ACCÃˆS : Chemin de Pied Cocu - NE PAS passer par le camping du Bourg (accès bloqué par portail). Horaires : 7h-19h (15/04-15/10), 8h-16h (16/10-14/04). Respecter le sens de l'itinéraire."
"41","Via Ferrata Malamort","Via ferrata de longueur moyenne proposant deux parcours distincts adaptés du débutant au confirmé, située à 425 mètres d'altitude dans un environnement naturel de forêt et cascade. Le parcours offre deux niveaux de difficulté : un itinéraire PD (peu difficile) pour les débutants d'une durée de 1h à 1h30, et un parcours D (difficile) pour les confirmés d'une durée de 1h30 à 2h. Le site dispose de 3 tyroliennes non évitables (sauf si échappatoire pris). Gaz faible, approche facile. Via ferrata accessible toute l'année dans le cadre verdoyant du Tarn. Contact : Tarn Tourisme ou Mairie de Durfort pour informations complémentaires."
"42","Via Ferrata de Rochefort","Via ferrata très sportive de niveau AD à ED avec plusieurs itinéraires de difficulté variable. L'entrée se fait par un passage étroit appelé ""le canyon"" (attention, peu évident à trouver par manque de balisage au départ). Une fois sorti, vue spectaculaire sur toute la vallée de Florac. Le parcours propose passerelles et pont de singe avant de se séparer en deux : itinéraire facile rejoignant la grande passerelle, ou difficile avec escalades. Après la grande passerelle, nouvelle séparation : parcours facile en traversée ou difficile par belle escalade dans le Ron de Picar. Ces deux itinéraires vertigineux mènent à une tyrolienne facultative de 50m avec poulie rapide. On arrive ensuite dans le grand pilier du Rochefort avec passage en vire à mi-hauteur puis choix entre sortie ultra sportive ""la casquette"" (à ne pas prendre à la légère) ou sortie plus tranquille par petit canyon intime et moins aérien. Durée 3-4h, gaz fort, exposition Est/Nord-Est. Accès : 35-45 min depuis parking Col de Pierre Plate. Location matériel : Loc Via 48 (15â‚¬/demi-journée)."
"43","Via Ferrata La Grande Falaise","Via ferrata historique créée en 1988 et modernisée depuis, offrant un panorama grandiose sur la vallée de Freissinières. Parcours long de 1000 mètres avec 200 mètres de dénivelé entre 1400m et 1600m d'altitude dans un environnement exceptionnel de haute montagne, falaise et forêt. Le parcours propose deux niveaux de difficulté AD et D adaptés du débutant au confirmé, sur rocher calcaire en exposition Sud avec un gaz fort. Durée d'ascension de 2 à 3 heures avec une approche courte de 10 minutes depuis le parking situé à 1330m (se garer en bordure de route dans l'épingle). Retour en 1 heure environ. Cette via longue et variée permet de découvrir la beauté sauvage des Hautes-Alpes dans un cadre préservé. Gare SNCF de L'Argentière-les-Ã‰crins à proximité."
"44","Via Ferrata Chaos de Coumély","Très belle via ferrata aérienne et plutôt sportive de niveau TD (voire TD+ si l'on emprunte le passage en noir sur le topo) dans un très beau cadre de haute montagne. Parcours de longueur moyenne de 400 mètres avec 180 mètres de dénivelé entre 1200m et 1380m d'altitude. La progression se fait essentiellement via des barreaux avec un passage sur passerelle. Gaz fort offrant des sensations aériennes remarquables. Durée moyenne de 2 heures, pouvant aller jusqu'à 4 heures en haute saison en cas d'affluence et de groupes engagés dans la via. Approche facile. Via ferrata en accès libre et gratuite sous la responsabilité des pratiquants, aucun accueil sur place. Possibilité de sorties encadrées par les guides de la vallée. Accessible toute l'année hors période d'enneigement. Contacter l'office de tourisme pour vérifier les conditions."
"45","Via Ferrata Le Siala","Via ferrata située sur une falaise dominant les Gorges du Valentin, offrant une autre façon d'escalader avec des sensations similaires à l'escalade. Parcours de 250 mètres avec 120 mètres de dénivelé entre 998m et 1118m d'altitude, proposant deux niveaux de difficulté D et TD selon les parcours. Le site offre des ponts de singe et des panoramas à couper le souffle dans une ambiance unique mi-canyon mi-aérienne. Exposition Nord/Nord-Ouest avec un gaz moyen. Approche facile. Cette via permet de découvrir les spectaculaires Gorges du Valentin dans un environnement de canyon et forêt. Réservé aux pratiquants confirmés. Ouverte hors période d'enneigement, non praticable l'hiver. Contacter l'office de tourisme pour vérifier les conditions. Possibilité de réserver avec un guide et l'équipement."
"46","Via Ferrata La Guinguette - L'Itinéraire des Buis","Via ferrata des montagnes de l'Ain entre Lyon et Genève offrant des points de vue magnifiques que seuls les grimpeurs peuvent admirer. L'Itinéraire des Buis de 700 mètres débute par une belle traversée très facile dans les buis avec possibilité de s'échapper vers sortie facile ou échelle de perroquet. Pour les plus aguéris, le parcours débouche sur la roche avec niveau progressif franchissant l'athlétique ""surplomb jaune"". Une strate vertigineuse permet l'accès au ""jardin"". La remontée aérienne accède à la superbe passerelle du ""saut du mouton"" procurant quelques émotions. Progression en face Sud-Ouest sur petit pilier suivi d'une traversée et dernier mur athlétique. Sortie verticale au Parc de Brangon (côte 732). Altitude 720m, exposition Ouest (soleil à partir de midi), gaz fort. Durée 1h30 à 2h30, approche 5 min, retour 10 min. Gare SNCF Tenay-Hauteville."
"47","Via Ferrata La Guinguette - L'Itinéraire de la Grotte","Via ferrata des montagnes de l'Ain entre Lyon et Genève offrant des points de vue magnifiques. L'Itinéraire de la Grotte de 350 mètres propose une succession de petits passages ludiques et variés : pont de singe, échelles, poutres. Parcours avec échappatoire permettant d'adapter selon le temps ou le niveau. 2 possibilités de sortie : sortie facile ou échelle de perroquet un peu plus athlétique. Possibilité de descendre et récupérer le grand parcours des Buis. Altitude 720m, exposition Ouest (soleil à partir de midi), gaz fort. Niveau AD à D. Durée 45 minutes à 1 heure, approche 5 min, retour 10 min. Gare SNCF Tenay-Hauteville à proximité."
"48","Via Ferrata La Pierre Ronde (Gorges de Sarenne) - Découverte","Via ferrata de l'Alpe d'Huez proposant un itinéraire ""Découverte"" de niveau PD dans les Gorges de Sarenne. Parcours assez long avec 200 mètres de dénivelé au départ de 1600m d'altitude, exposé plein Sud. Ce parcours permet une belle initiation dans un environnement de falaise avec un gaz fort offrant des sensations aériennes. Durée d'ascension : 2 heures. La via se situe dans le magnifique cadre de l'Oisans avec marche d'approche nécessitant un petit effort. Idéal pour les débutants souhaitant découvrir l'activité dans un cadre alpin exceptionnel. Ouvert du 1er juin au 31 octobre. Guide Via ferrata et Escalade en Oisans disponible à l'office de tourisme."
"49","Via Ferrata La Pierre Ronde (Gorges de Sarenne) - Sportive","Via ferrata de l'Alpe d'Huez proposant un itinéraire ""Sportive"" de niveau D+ dans les Gorges de Sarenne. Parcours assez long et technique avec 200 mètres de dénivelé au départ de 1600m d'altitude, exposé plein Sud. Ce parcours sportif offre des passages plus engagés dans un environnement de falaise avec un gaz fort procurant de belles sensations aériennes. Durée d'ascension : 2h30. La via se situe dans le magnifique cadre de l'Oisans avec marche d'approche nécessitant un petit effort. Réservé aux pratiquants confirmés recherchant un défi technique dans un cadre alpin exceptionnel. Ouvert du 1er juin au 31 octobre. Guide Via ferrata et Escalade en Oisans disponible à l'office de tourisme."
"50","Via Ferrata L'Horloge","Via ferrata très courte de 150 mètres adaptée aux enfants à partir de 10 ans, située dans un environnement mixte de ville et falaise. Parcours rapide avec seulement 50 mètres de dénivelé entre 1000m et 1050m d'altitude sur rocher calcaire en exposition Est. Durée d'ascension inférieure à 30 minutes avec approche facile de 5 minutes. Niveau PD+ avec gaz faible. ATTENTION : malgré sa courte longueur et sa cotation accessible, la sortie du parcours est athlétique et pas si facile. Bien équiper les enfants en conséquence et être sûr de leurs capacités avant de s'engager. Le retour se fait en 10 minutes avec 20 mètres de câble pour descendre la falaise (garder le baudrier). Gare SNCF de L'Argentière-les-Ã‰crins à quelques minutes à pied. Bureau des guides des Ã‰crins disponible pour encadrement."
"51","Via Ferrata de Roqueprins","Via ferrata se développant dans un cadre exceptionnel et vertigineux avec vue permanente sur le superbe village de La Canourgue situé 350 mètres plus bas. Le parcours débute par une descente verticale d'une trentaine de mètres en zigzag pour atteindre le premier monolithe Est. Deux itinéraires (facile AD et difficile D) sont proposés et se rejoignent pour accéder à une grande passerelle de 30 mètres. L'itinéraire contourne le monolithe central imposant pour arriver au départ du long pont népalais de 35 mètres. Dans la traversée du rocher central, l'itinéraire difficile descend puis remonte dans un filet vertical de 11 mètres avant de rejoindre le parcours facile. Deux options de sortie : ponts de singe (facile) ou pont népalais puis pont de singe (difficile). Tyrolienne facultative avec poulie rapide (speed). Durée environ 2h, dénivelé 90m, altitude 800m, exposition Nord-Est. Conception Antipodes 2010-2011. Location matériel : Loc Via 48 (15â‚¬/demi-journée)."
"52","Via Ferrata Les Saix de Miolène - Le Cabri (1er tronçon)","Premier tronçon ""Le Cabri"" de la via ferrata des Saix de Miolène dans la Vallée d'Abondance, terre d'histoire aux paysages en mosaïque. Parcours de 350 mètres de niveau AD+ en exposition Sud-Est, accessible aux adultes et enfants de minimum 1m40. L'itinéraire évolue dans une face aérienne avec passages rocheux formés d'une succession de vires, de dièdres et de surplombs. Grande traversée endurante et aérienne sur grandes dalles lisses à montée directe. Gaz fort de 200m dans le dos. Durée 1h30 à 2h (retour 20-30 min), accès en 15 min par le sentier du menhir depuis parking RD 22. Peut être enchaîné avec les tronçons Le Chamois et Le Bouquetin. 2 échappatoires disponibles. Location matériel chez Bouvet Sport (Abondance) ou Trincaz Sports (La Chapelle d'Abondance)."
"53","Via Ferrata Les Saix de Miolène - Le Chamois (2ème tronçon)","Deuxième tronçon ""Le Chamois"" de la via ferrata des Saix de Miolène, parcours sportif de niveau TD (très difficile) à aborder par des ferratistes accomplis ou encadrés. Nombreux passages athlétiques soutenus avec surplombs courts et dévers prolongés assez tire-bras, gaz fort de 200m dans le dos. Longueur cumulée avec Le Cabri : 700m. Exposition Sud-Est sur face aérienne. Via intéressante dans le genre sportif avec progression sur grandes dalles lisses. Taille minimum 1m40. Durée cumulée 2-3h (retour 25-35 min), accès 15 min par sentier du menhir. Peut être précédé du tronçon Le Cabri et suivi du Bouquetin. 2 échappatoires disponibles. Location matériel chez Bouvet Sport (Abondance) ou Trincaz Sports (La Chapelle d'Abondance)."
"54","Via Ferrata Les Saix de Miolène - Le Bouquetin (3ème tronçon)","Troisième et dernier tronçon ""Le Bouquetin"" de la via ferrata des Saix de Miolène, parcours très sportif de niveau TD (très difficile) à aborder par des ferratistes accomplis ou encadrés. Nombreux passages athlétiques très soutenus avec surplombs courts et dévers prolongés assez tire-bras. Particulièrement aérien en fin de parcours sur grandes dalles bien lisses à montée directe avec gaz fort de 200m dans le dos. Longueur totale cumulée : 900m. Exposition Sud-Est. Taille minimum 1m40. Durée cumulée complète 3-5h (retour 30-45 min), accès 15 min par sentier du menhir. Progressive dans la difficulté des 3 tronçons. Via intéressante dans le genre sportif : grande traversée endurante et très aérienne. 2 échappatoires disponibles. Location matériel chez Bouvet Sport (Abondance) ou Trincaz Sports (La Chapelle d'Abondance)."
"55","Via Ferrata Yves Pollet-Villard","Via ferrata offrant découverte et ambiance montagne au Col des Aravis. Parcours assez long de 700 mètres avec 300 mètres de dénivelé entre 1500m et 1800m d'altitude, de niveau D avec un passage D+ en sortie. Le parcours évolue dans un environnement de falaise et forêt avec un gaz fort offrant des sensations aériennes remarquables. Durée totale de 3h à 4h incluant 20 minutes de marche d'approche et 45 minutes de retour. Réservé aux pratiquants confirmés. Parking situé sur la route du Col des Aravis. IMPORTANT : Par arrêté préfectoral, la via ferrata est interdite du 15 novembre au 5 mai. En dehors de cette période, elle peut également être fermée si la visite de contrôle n'a pas été effectuée ou si un enneigement trop important rend le retour dangereux. Vérifier auprès de l'office de tourisme avant de partir."
"56","Via Ferrata Les Gorges d'Agnielles - Facile","Via ferrata des Gorges d'Agnielles, parcours facile de 500 mètres composé de deux itinéraires dans un environnement exceptionnel de falaise, grottes et forêt. Le parcours débute par un petit mur et suit une grande vire aérienne avant de passer à travers 2 grottes. On atteint ensuite la vire aérienne des hirondelles (échappatoire possible avec rappel de 20m). Le parcours franchit un mur vertical puis une dernière traversée gazeuse permettant de sortir de l'itinéraire (rappel possible de 30m) qui ramène vers la piste par des câbles. Descente de 20 minutes en continuant vers la droite (est). Dénivelé de 50 mètres entre 828m et 878m d'altitude, exposition Est. Durée d'ascension : 1 heure environ, approche facile de 10 minutes. Gaz moyen. Gares SNCF à proximité : Aspres-sur-Buëch et Veynes-Dévoluy."
"57","Via Ferrata Les Gorges d'Agnielles - Sportif","Via ferrata des Gorges d'Agnielles, parcours sportif de 300 mètres de niveau TD composé de deux itinéraires dans un environnement exceptionnel de falaise, grottes et forêt. Le parcours débute par un petit mur et suit une grande vire aérienne avant de passer à travers 2 grottes. On atteint ensuite la vire aérienne des hirondelles (échappatoire possible avec rappel de 20m). Le parcours sportif franchit un mur vertical puis une dernière traversée gazeuse permettant de sortir de l'itinéraire (rappel possible de 30m) qui ramène vers la piste par des câbles. Descente de 20 minutes en continuant vers la droite (est). Dénivelé de 50 mètres entre 828m et 878m d'altitude, exposition Est. Durée d'ascension : 1 heure environ, approche facile de 10 minutes. Gaz moyen. Gares SNCF à proximité : Aspres-sur-Buëch et Veynes-Dévoluy."
"58","Via Ferrata Les Mines du Grand Clot","Via ferrata historique exceptionnelle de 2000 mètres entre la combe de Malaval et le plateau d'Emparis. Les parois abruptes de 1000 mètres de roche verticale surplombent la route et la rivière. Ce parcours suit les anciens chemins des mineurs qui extrayaient la galène de mines suspendues au-dessus du vide. Les sentiers taillés et équipés d'une main courante ont été les prémices de la via ferrata en tant que parcours-loisir. La grande échelle (cheminée) de 200m faisait partie du parcours jusqu'en 2016 avant déviation suite à éboulements. Le parcours touche l'entrée de galeries minières avec panneaux d'information historiques tout au long, offrant une aventure culturelle et sportive unique. Niveau D avec gaz fort, 750 mètres de dénivelé entre 1330m et 2080m. Durée totale 5h30 (approche 10 min, retour 1h30). IMPORTANT : Positionner une voiture au village du Chazelet (arrivée) pour éviter 2h de marche supplémentaire."
"59","Via Ferrata La Cascade","Via ferrata de la Cascade offrant une succession de passages ludiques idéale pour une mise en jambe. Le parcours de longueur moyenne propose des ponts de singe au-dessus du canyon, l'ascension de courts ressauts rocheux et des traversées en balcon dominant la vallée. Niveau PD avec gaz faible dans un environnement de forêt et cascade en orientation Sud-Ouest. Parfaitement adaptée aux enfants et débutants avec 2 échappatoires disponibles. Durée de 1h à 1h30 avec retour en 30 à 45 minutes. Approche facile. Située dans le Massif du Taillefer, cette via permet de découvrir l'activité en douceur dans un cadre naturel préservé. Accessible dès qu'il n'y a plus de neige, période favorable d'avril à octobre. Gare SNCF de Jarrie-Vizille à 35 minutes en voiture."
